<?xml version="1.0" encoding="UTF-8" ?>
<!DOCTYPE actionMappings SYSTEM "ubar.dtd">

<actionMappings>
	<!-- when the request is "", find the action with the below name -->
	<defaultAction name="Home" />
	
	<!-- common results that do not change across actions -->
	<globalResults>
		<result name="ERROR">error</result>
		<result name="JSON">json</result>
		<result name="IMG">img</result>
	</globalResults>
	
	<!-- templates to render page within, add template=TEMPLATE_NAME to an action def to use -->
	<templates>
		<template name="default" path="templates.default" />
	</templates>
	
	<!-- common sets of required permissions for an action, may appear more than once in an action def, additive -->
	<permissionGroups>
		<permissionGroup name="default">
			<permission name="view" />
		</permissionGroup>
		<permissionGroup name="authorized">
			<permission name="view" />
		</permissionGroup>
		<permissionGroup name="admin">
			<permission name="view" />
			<permission name="update" />
			<permission name="delete" />
		</permissionGroup>
	</permissionGroups>
	
	<!-- action definitions, must have a name to refer to by, dot separated path to class def -->
	<!-- if no action class def, try to just do view -->
	<!-- @type - type of action, may be "page", "json", "dispatcher"
		"page" renderes a page in markup and requires a valid view def
		"json" renders assembled data as json notation using a standard json serialization
		"dispatcher" requires that you redirect to another action after completing the work if the given action
	-->
	<!-- @view - location of php file to render the view. this should have access to public methods of the action and base action -->
	
	<actions>
		<action name="Home" path="Home" view="pages.home" template="default">
			<permissionGroup name="default" />
			<permissions>
				<permission name="update" />
				<permission name="delete" />
			</permissions>
			<results>
				<result name="STATIC_CONTENT" type="url">http://www.skylist.net</result>
				<result name="ERROR" type="action">Error</result>
				<result name="ALT_VIEW">pages.misc.testPage</result>
				<result name="JSON" type="json" />
			</results>
		</action>
		<action name="Contact" path="Contact" view="pages.contact" template="default">
			<permissionGroup name="default" />
			<permissions>
				<permission name="update" />
				<permission name="delete" />
			</permissions>
			<results>
				<result name="ERROR" type="action">Error</result>
				<result name="ALT_VIEW">pages.misc.testPage</result>
				<result name="JSON" type="json" />
			</results>
		</action>
		<!-- update to no path meaning that result is automatically SUCCESS -->
		<action name="Resume" path="Resume" view="pages.resume" template="default" />
		<action name="Blog" path="Blog" view="pages.blog" template="default" />
	</actions>
</actionMappings>